,id,command_de,label_de,command_en,label_en
381,Tv.WatchNextEpisode.Init.Utterance,die nächste Folge bitte,{Template} {Template} {Template} {Template},play following episode,{Template} {Template} {Template}
382,Tv.WatchNextEpisode.Init.Utterance,kannst du bitte die nächste Folge abspielen,{Template} {Template} {Template} {Template} {Template} {Template} {Template},go to the next episode,{Template} {Template} {Template} {Template} {Template}
383,Tv.WatchNextEpisode.Init.Utterance,kannst du bitte die nächste Folge abspielen,{Template} {Template} {Template} {Template} {Template} {Template} {Template},I'd like to watch the next episode please,{Template}'{Template} {Template} {Template} {Template} {Template} {Template} {Template} {Template}
384,Tv.WatchNextEpisode.Init.Utterance,weiter mit der nächsten Folge,{Template} {Template} {Template} {Template} {Template},continue with the next episode,{Template} {Template} {Template} {Template} {Template}
385,Tv.WatchNextEpisode.Init.Utterance,die nächste Episode wiedergeben bitte,{Template} {Template} {Template} {Template} {Template},next episode,{Template} {Template}
386,Tv.WatchNextEpisode.Init.Utterance,eine Folge geht noch,{Template} {Template} {Template} {Template},continue with the next episode,{Template} {Template} {Template} {Template} {Template}
387,Tv.WatchNextEpisode.Init.Utterance,eine weitere Folge bitte,{Template} {Template} {Template} {Template},next episode,{Template} {Template}
388,Tv.WatchNextEpisode.Init.Utterance,spiele die nächste Folge ab,{Template} {Template} {Template} {Template} {Template},can you play the next episode,{Template} {Template} {Template} {Template} {Template} {Template}
389,Tv.WatchNextEpisode.Init.Utterance,bitte mit der nächsten Folge weitermachen,{Template} {Template} {Template} {Template} {Template} {Template},go to the next episode,{Template} {Template} {Template} {Template} {Template}
